number,value,datetime_start,datetime_complete,duration,params_criterion,params_max_depth,params_max_features,params_min_samples_leaf,params_min_samples_split,params_n_estimators,state
0,0.8034833012251813,2026-08-04 03:07:37.183814,2026-08-04 03:07:38.731646,0 days 00:00:01.547832,gini,13,sqrt,6,15,383,COMPLETE
1,0.789588935278629,2026-08-04 03:07:38.731703,2026-08-04 03:07:39.622291,0 days 00:00:00.890588,entropy,22,sqrt,9,20,57,COMPLETE
2,0.8078404957416474,2026-08-04 03:07:39.622349,2026-08-04 03:07:42.414856,0 days 00:00:02.792507,gini,15,,2,13,152,COMPLETE
3,0.8006075220291835,2026-08-04 03:07:42.414918,2026-08-04 03:07:43.732141,0 days 00:00:01.317223,gini,17,,7,2,257,COMPLETE
4,0.7959471562158769,2026-08-04 03:07:43.732181,2026-08-04 03:07:43.906586,0 days 00:00:00.174405,gini,11,log2,5,15,84,COMPLETE
5,0.8044658350043564,2026-08-04 03:07:43.906630,2026-08-04 03:07:44.212329,0 days 00:00:00.305699,gini,21,log2,6,11,159,COMPLETE
6,0.8190416014914585,2026-08-04 03:07:44.212377,2026-08-04 03:07:45.397787,0 days 00:00:01.185410,entropy,19,,2,3,373,COMPLETE
7,0.8049210186858474,2026-08-04 03:07:45.397831,2026-08-04 03:07:45.829519,0 days 00:00:00.431688,gini,12,,2,12,148,COMPLETE
8,0.7628295722088068,2026-08-04 03:07:45.829568,2026-08-04 03:07:46.407035,0 days 00:00:00.577467,entropy,3,sqrt,8,15,336,COMPLETE
9,0.8123001041187144,2026-08-04 03:07:46.407072,2026-08-04 03:07:46.743725,0 days 00:00:00.336653,gini,20,log2,4,3,166,COMPLETE
10,0.788717726647298,2026-08-04 03:07:46.743764,2026-08-04 03:07:47.510880,0 days 00:00:00.767116,entropy,29,,10,7,285,COMPLETE
11,0.8154442589177664,2026-08-04 03:07:47.510922,2026-08-04 03:07:48.054880,0 days 00:00:00.543958,entropy,25,log2,4,2,266,COMPLETE
12,0.81731920797155,2026-08-04 03:07:48.054927,2026-08-04 03:07:48.879900,0 days 00:00:00.824973,entropy,27,log2,1,5,398,COMPLETE
13,0.8211839948096248,2026-08-04 03:07:48.879940,2026-08-04 03:07:50.195941,0 days 00:00:01.316001,entropy,29,,1,6,391,COMPLETE
14,0.8212857931788914,2026-08-04 03:07:50.195982,2026-08-04 03:07:51.362309,0 days 00:00:01.166327,entropy,30,,1,8,349,COMPLETE
15,0.8215022855197821,2026-08-04 03:07:51.362348,2026-08-04 03:07:52.399780,0 days 00:00:01.037432,entropy,30,,1,8,324,COMPLETE
16,0.8084052097408276,2026-08-04 03:07:52.399825,2026-08-04 03:07:53.389870,0 days 00:00:00.990045,entropy,25,,3,9,319,COMPLETE
17,0.8164807515594072,2026-08-04 03:07:53.389923,2026-08-04 03:07:54.162440,0 days 00:00:00.772517,entropy,30,,1,9,237,COMPLETE
18,0.8071681940895973,2026-08-04 03:07:54.162494,2026-08-04 03:07:55.209828,0 days 00:00:01.047334,entropy,25,,3,9,324,COMPLETE
19,0.8082872338976517,2026-08-04 03:07:55.209883,2026-08-04 03:07:55.995398,0 days 00:00:00.785515,entropy,27,,3,7,231,COMPLETE
20,0.8117737342296703,2026-08-04 03:07:55.995445,2026-08-04 03:07:56.700205,0 days 00:00:00.704760,entropy,23,sqrt,1,19,354,COMPLETE
21,0.8199479270956773,2026-08-04 03:07:56.700256,2026-08-04 03:07:57.678192,0 days 00:00:00.977936,entropy,30,,1,6,299,COMPLETE
22,0.8155858132214121,2026-08-04 03:07:57.678248,2026-08-04 03:07:59.043758,0 days 00:00:01.365510,entropy,28,,2,5,357,COMPLETE
23,0.8181841832228288,2026-08-04 03:07:59.043804,2026-08-04 03:08:00.373843,0 days 00:00:01.330039,entropy,30,,1,8,394,COMPLETE
24,0.8105397491240156,2026-08-04 03:08:00.373886,2026-08-04 03:08:01.512730,0 days 00:00:01.138844,entropy,27,,2,11,352,COMPLETE
25,0.8107648197643978,2026-08-04 03:08:01.512783,2026-08-04 03:08:02.497646,0 days 00:00:00.984863,entropy,25,,3,5,310,COMPLETE
26,0.8152510573978585,2026-08-04 03:08:02.497688,2026-08-04 03:08:03.581234,0 days 00:00:01.083546,entropy,28,,1,10,337,COMPLETE
27,0.8015890228574003,2026-08-04 03:08:03.581287,2026-08-04 03:08:04.473656,0 days 00:00:00.892369,entropy,23,,4,7,288,COMPLETE
28,0.7974380453112829,2026-08-04 03:08:04.473697,2026-08-04 03:08:05.519890,0 days 00:00:01.046193,entropy,7,,2,4,369,COMPLETE
29,0.8091962556766221,2026-08-04 03:08:05.519939,2026-08-04 03:08:06.316203,0 days 00:00:00.796264,entropy,26,sqrt,1,13,400,COMPLETE
30,0.8150437405251199,2026-08-04 03:08:06.316245,2026-08-04 03:08:06.760850,0 days 00:00:00.444605,entropy,30,sqrt,3,8,194,COMPLETE
31,0.8190010810724306,2026-08-04 03:08:06.760890,2026-08-04 03:08:07.770227,0 days 00:00:01.009337,entropy,30,,1,6,300,COMPLETE
32,0.8133058248580716,2026-08-04 03:08:07.770290,2026-08-04 03:08:08.979679,0 days 00:00:01.209389,entropy,28,,2,6,375,COMPLETE
33,0.8186636060715866,2026-08-04 03:08:08.979721,2026-08-04 03:08:10.109546,0 days 00:00:01.129825,entropy,23,,1,6,340,COMPLETE
34,0.8130337112855374,2026-08-04 03:08:10.109589,2026-08-04 03:08:10.965287,0 days 00:00:00.855698,entropy,29,,2,8,268,COMPLETE
35,0.8169274303899732,2026-08-04 03:08:10.965331,2026-08-04 03:08:11.919273,0 days 00:00:00.953942,gini,28,,1,4,302,COMPLETE
36,0.8114463229115024,2026-08-04 03:08:11.919327,2026-08-04 03:08:13.146476,0 days 00:00:01.227149,entropy,26,,2,10,380,COMPLETE
37,0.8177412834912834,2026-08-04 03:08:13.146529,2026-08-04 03:08:13.660917,0 days 00:00:00.514388,gini,30,sqrt,1,7,248,COMPLETE
38,0.8113037011169976,2026-08-04 03:08:13.660960,2026-08-04 03:08:14.245444,0 days 00:00:00.584484,entropy,15,log2,3,4,282,COMPLETE
39,0.8062878462670238,2026-08-04 03:08:14.245518,2026-08-04 03:08:15.147949,0 days 00:00:00.902431,gini,24,,5,10,329,COMPLETE
40,0.8112358706058155,2026-08-04 03:08:15.147992,2026-08-04 03:08:16.263954,0 days 00:00:01.115962,entropy,21,,2,12,355,COMPLETE
41,0.8184146604413325,2026-08-04 03:08:16.263994,2026-08-04 03:08:17.486859,0 days 00:00:01.222865,entropy,18,,2,2,374,COMPLETE
42,0.8155904438788107,2026-08-04 03:08:17.486901,2026-08-04 03:08:17.842081,0 days 00:00:00.355180,entropy,9,,1,3,101,COMPLETE
43,0.8165579329519582,2026-08-04 03:08:17.842129,2026-08-04 03:08:19.064991,0 days 00:00:01.222862,entropy,17,,2,3,365,COMPLETE
44,0.8125213025558538,2026-08-04 03:08:19.065033,2026-08-04 03:08:19.760550,0 days 00:00:00.695517,entropy,20,log2,2,6,341,COMPLETE
45,0.8198339155895088,2026-08-04 03:08:19.760597,2026-08-04 03:08:20.737166,0 days 00:00:00.976569,gini,14,,1,5,317,COMPLETE
46,0.8042728923814828,2026-08-04 03:08:20.737205,2026-08-04 03:08:21.573093,0 days 00:00:00.835888,gini,7,,1,5,311,COMPLETE
47,0.7957124998936898,2026-08-04 03:08:21.573136,2026-08-04 03:08:22.141991,0 days 00:00:00.568855,gini,14,,9,8,214,COMPLETE
48,0.814815593661246,2026-08-04 03:08:22.142031,2026-08-04 03:08:23.018326,0 days 00:00:00.876295,gini,29,,1,7,293,COMPLETE
49,0.7724457297412857,2026-08-04 03:08:23.018370,2026-08-04 03:08:23.563783,0 days 00:00:00.545413,gini,4,log2,1,17,270,COMPLETE
